{
  "id": "agents-05",
  "trackId": "agents",
  "level": 5,
  "title": "元认知与自我反思机制",
  "summary": "本关练习：构建“自然语言转 SQL 报表 Agent”的自检自愈闭环。",
  "source": "Microsoft AI Agents for Beginners (77.2k Stars)",
  "readMinutes": 5,
  "lessonHtml": "<h3>核心原理</h3>\n<p>为什么顶级 Agent 写出的代码或报告极少出错？因为它们不会把第一次生成的结果直接丢给用户！根据 Microsoft AI Agents for Beginners 第 9 课(Metacognition) 与 Agentic AI Masterclass 的 Execution Hooks 机制，元认知(Metacognition)是指让 Agent 具备“自我监控、自我评估与自我纠错”能力。核心实现模式是构建 Actor-Critic（执行者-审查者）内部循环：当 Actor 生成初稿或 SQL/Python 代码后，先由验证器（确定性单元测试 / 语法检查器 + Critic 审查提示词）按评分标准打分；只有全部指标达标才放行输出，否则将具体报错信息喂回给 Actor 进行定向修复（上限 2‒3 轮）。</p>\n<h2>第 5 关实操练习题：构建“自然语言转 SQL 报表 Agent”的自检自愈闭环</h2>\n<h3>任务背景</h3>\n<p>业务人员用自然语言让 Agent 查询数据库生成月度销售报表，直接执行模型生成的 SQL 极易出现字段名拼写错误、漏加时间过滤条件或慢查询锁表。</p>\n<h3>通关硬性要求（满分 12.5 分）</h3>\n<p>1. 设计 Generator → Validator → Refiner 三步元认知工作流（4 分）；</p>\n<p>2. 在 Validator 阶段同时设置【确定性规则检查】（如拦截 DROP/DELETE/UPDATE、强制检查是否包含 LIMIT与分区日期过滤）与【语义对齐检查】（核对是否遗漏业务口径）（5.5 分）；</p>\n<p>3. 定义带着数据库报错堆栈(Error Traceback)回传给 Refiner 的结构化修复模板与最大重试上限（3分）。</p>",
  "referenceAnswerHtml": "<div class=\"code-block\"><button class=\"copy-btn\" type=\"button\" data-copy>复制</button><pre><code>def run_self_healing_sql_agent(user_query: str, max_retries: int = 3):\n    draft_sql = sql_generator_agent.run(user_query)\n    for attempt in range(1, max_retries + 1):\n        # 1. 确定性安全与性能护栏检查（Deterministic Hook）\n        if any(bad in draft_sql.upper() for bad in [\"DROP \", \"DELETE \", \"UPDATE \", \"TRUNCATE \"]):\n            return {\"error\": \"安全拦截：禁止执行非只读 SQL 语句\"}\n        if \"LIMIT\" not in draft_sql.upper() or \"dt &gt;=\" not in draft_sql:\n            feedback = \"缺少分区字段 dt 过滤或未添加 LIMIT 限制，存在全表扫描风险，请修正。\"\n            draft_sql = sql_refiner_agent.run(query=user_query, bad_sql=draft_sql, error=feedback)\n            continue\n\n        # 2. 沙盒 EXPLAIN 语法与字段验证 + Critic 语义核对\n        exec_result = db_sandbox.explain_and_validate(draft_sql)\n        if not exec_result.is_valid:\n            # 将真实数据库报错堆栈喂回 Refiner 定向修复\n            draft_sql = sql_refiner_agent.run(\n                query=user_query,\n                bad_sql=draft_sql,\n                error=exec_result.traceback,\n            )\n            continue\n\n        critic_check = sql_critic_agent.verify_business_logic(user_query, draft_sql)\n        if critic_check.passed:\n            return db_sandbox.execute_readonly(draft_sql)\n        draft_sql = sql_refiner_agent.run(\n            query=user_query,\n            bad_sql=draft_sql,\n            error=critic_check.reason,\n        )\n    return {\"error\": \"超过最大自愈重试次数，已转人工数据工程师处理\"}</code></pre></div>\n<h3>得分要点拆解</h3>\n<p>清晰实现 Generator → Validator → Refiner 循环（4 分）；结合确定性正则/分区拦截与 Critic业务逻辑核验（5.5 分）；将真实 Traceback 注入修复提示并限制最大重试次数（3 分）。</p>",
  "exercise": {
    "id": "agents-05-ex",
    "title": "构建“自然语言转 SQL 报表 Agent”的自检自愈闭环",
    "minLength": 40,
    "criteria": [
      {
        "id": "c1",
        "label": "设计 Generator → Validator → Refiner 三步元认知工作流",
        "weight": 4.0,
        "type": "term_groups",
        "groups": [
          {
            "label": "Generator",
            "terms": [
              "generator"
            ]
          },
          {
            "label": "Validator",
            "terms": [
              "validator"
            ]
          },
          {
            "label": "Refiner",
            "terms": [
              "refiner"
            ]
          }
        ]
      },
      {
        "id": "c2",
        "label": "在 Validator 阶段同时设置【确定性规则检查】（如拦截 DROP/DELETE/UPDATE、强制检查是否包含 LIMIT与分区日期过滤）与【语义对齐检查】（核对是否遗漏业务口径）",
        "weight": 5.5,
        "type": "term_groups",
        "groups": [
          {
            "label": "drop",
            "terms": [
              "drop",
              "delete",
              "update"
            ]
          },
          {
            "label": "limit",
            "terms": [
              "limit"
            ]
          },
          {
            "label": "日期",
            "terms": [
              "日期",
              "分区"
            ]
          },
          {
            "label": "语义",
            "terms": [
              "语义",
              "业务口径"
            ]
          }
        ]
      },
      {
        "id": "c3",
        "label": "定义带着数据库报错堆栈(Error Traceback)回传给 Refiner 的结构化修复模板与最大重试上限",
        "weight": 3.0,
        "type": "term_groups",
        "groups": [
          {
            "label": "traceback",
            "terms": [
              "traceback",
              "报错"
            ]
          },
          {
            "label": "重试",
            "terms": [
              "重试",
              "上限"
            ]
          }
        ]
      }
    ]
  },
  "next": "agents-06",
  "knowledgeChecks": [
    {
      "question": "Generator → Validator → Refiner 中 Validator 主要做什么？",
      "options": [
        "确定性规则检查与语义对齐检查",
        "生成 SQL",
        "压缩上下文",
        "写入长期记忆"
      ],
      "answer": 0,
      "explanation": "Validator 拦截危险 SQL、检查日期/LIMIT 等硬规则，并核对业务口径。",
      "id": "q1"
    },
    {
      "question": "Generator → Validator → Refiner 中，确定性规则检查的例子是？",
      "options": [
        "拦截 DROP/DELETE 等危险 SQL",
        "判断业务语义",
        "生成 SQL",
        "写入记忆"
      ],
      "answer": 0,
      "explanation": "危险语句、LIMIT、分区过滤等可以靠硬规则检查。",
      "id": "q2"
    },
    {
      "question": "数据库报错堆栈应该怎么处理？",
      "options": [
        "回传给 Refiner 定向修复",
        "直接丢弃",
        "转给用户",
        "忽略"
      ],
      "answer": 0,
      "explanation": "真实报错是修复 SQL 的关键反馈，应进入下一轮修复。",
      "id": "q3"
    }
  ],
  "reading": {
    "quote": "Microsoft 第 9 课 Metacognition：让 Agent 观察、评估并修正自己的推理；本关 PDF 把它工程化为 Generator → Validator → Refiner 三步。",
    "points": [
      "生成之后需要校验，不能把第一次生成直接当作最终结果。",
      "校验可以包含确定性规则和语义核对。",
      "失败时把错误反馈给 Refiner 做定向修复。",
      "重试要有上限，超过上限转人工处理。"
    ],
    "guide": "读第 9 课后，把练习里的 Validator 分成“硬规则”和“语义核对”两类，Refiner 只负责按反馈修复。",
    "example": "PDF 第 5 关的 SQL 安全拦截、LIMIT/分区检查、报错回传和最大重试次数就是本关来源例子。",
    "takeaway": "可靠 Agent 不是一次写对，而是有校验和返工。",
    "refs": [
      [
        "Microsoft · Lesson 9 Metacognition",
        "https://github.com/microsoft/ai-agents-for-beginners/blob/main/09-metacognition/README.md"
      ],
      [
        "PDF 第 5 关",
        ""
      ]
    ]
  }
}
