{
  "id": "rag-06",
  "trackId": "rag",
  "level": 6,
  "title": "多轮对话与查询改写",
  "summary": "本关练习：编写多轮对话指代消解与复杂对比问题拆解器。",
  "source": "StepByStep-RAG / GraphRAG / RAG 评估实践",
  "readMinutes": 4,
  "lessonHtml": "<h3>核心原理</h3>\n<p>StepByStep-RAG 的第四模块 ConvoRAG 解决了单轮 RAG 走向真实聊天应用的最大拦路虎——多轮对话中的指代消解(Coreference Resolution)。例如：第 1 轮用户问“Grand Palace 酒店的豪华海景房多少钱一晚？”,第 2 轮用户紧接着问“那它包含免费双人早餐和机场接送吗？”。如果直接拿第 2 轮原话“那它包含免费双人早餐和机场接送吗？”去向量库检索，由于丢失了主语“Grand Palace 酒店豪华海景房”,检索器会把全库所有提到早餐的无关文档搜出来！因此，在检索之前必须增加一步独立查询改写器(Contextual Query Rewriter)，并可结合 RAG Zero to Hero Guide 中的 HyDE（假设性文档嵌入） 或Sub-Query Decomposition（多子问题拆解）。</p>\n<h2>第 6 关实操练习题：编写多轮对话指代消解与复杂对比问题拆解器</h2>\n<h3>任务背景</h3>\n<p>用户在第 1 轮问了“Pro 版会员的年费是多少？”,第 2 轮追问：“那它跟企业旗舰版在 API 每分钟调用限额上有什么区别？”</p>\n<h3>通关硬性要求（满分 12.5 分）</h3>\n<p>1. 设计前置 Query Rewriter 提示词：结合历史对话 &lt;chat_history&gt; 与当前追问 &lt;latest_question&gt;,将含代词“它”的句子改写为主语完整、可独立检索的句子（4.5 分）；</p>\n<p>2. 针对“A 与 B 有什么区别”这类对比型问题，设计拆解为两条独立检索子查询(Sub-queries)的JSON 输出格式，避免单次检索只召回 A 而漏掉 B（5 分）；</p>\n<p>3. 说明若用户第 2 轮只是说“谢谢，讲得很清楚”,系统应如何跳过向量库检索以节省延迟（3 分）。</p>\n<h3>第四阶段</h3>\n<p>高阶生产篇（第 7‒8 关）——知识图谱 GraphRAG、流式应用与评估体系</p>",
  "referenceAnswerHtml": "<h2>前置查询改写与拆解器 Prompt(Query Rewriter &amp; Decomposer)</h2>\n<p>请结合 &lt;chat_history&gt; 将用户的 &lt;latest_question&gt; 转化为面向向量检索引擎的优化查询 JSON。</p>\n<p>规则说明：</p>\n<p>1. 闲聊豁免：若用户最新输入仅为感谢、寒暄或确认（如“谢谢”、“明白了”），将 need_retrieval 设为false,无需检索知识库。</p>\n<p>2. 指代消解：将“它、这个、上述方案”等代词替换为历史对话中的完整专有名称。</p>\n<p>3. 对比拆解：若问题涉及两个或多个对象的对比（如“A 和 B 在某方面的区别”），必须拆分为多条独立的单实体检索语句放入 sub_queries 数组，确保两边资料都能被召回。</p>\n<p>&lt;chat_history&gt;User: Pro 版会员的年费是多少？</p>\n<p>Assistant: Pro 版会员标准年费为 1,999 元/年。</p>\n<p>&lt;/chat_history&gt;&lt;latest_question&gt;那它跟企业旗舰版在 API 每分钟调用限额上有什么区别？&lt;/latest_question&gt;</p>\n<h2>标准输出 JSON</h2>\n<div class=\"code-block\"><button class=\"copy-btn\" type=\"button\" data-copy>复制</button><pre><code>{\n  \"need_retrieval\": true,\n  \"standalone_query\": \"Pro 版会员与企业旗舰版会员在 API 每分钟调用限额(RPM)上有什么区别?\",\n  \"sub_queries\": [\n    \"Pro 版会员 API 每分钟调用限额 RPM 配额规定\",\n    \"企业旗舰版会员 API 每分钟调用限额 RPM 配额规定\"\n  ]\n}</code></pre></div>\n<h3>得分要点拆解</h3>\n<p>准确将代词“它”还原为“Pro 版会员”（4.5 分）；将对比问题拆解为两条独立单实体检索语句 `sub_queries`（5 分）；设置 `need_retrieval` 布尔开关过滤纯闲聊轮次（3 分）。</p>",
  "exercise": {
    "id": "rag-06-ex",
    "title": "编写多轮对话指代消解与复杂对比问题拆解器",
    "minLength": 40,
    "criteria": [
      {
        "id": "c1",
        "label": "设计前置 Query Rewriter 提示词：结合历史对话 <chat_history> 与当前追问 <latest_question>,将含代词“它”的句子改写为主语完整、可独立检索的句子",
        "weight": 4.5,
        "type": "term_groups",
        "groups": [
          {
            "label": "Query Rewriter",
            "terms": [
              "rewriter",
              "query"
            ]
          },
          {
            "label": "历史",
            "terms": [
              "历史",
              "chat_history"
            ]
          },
          {
            "label": "代词",
            "terms": [
              "代词",
              "它"
            ]
          }
        ]
      },
      {
        "id": "c2",
        "label": "针对“A 与 B 有什么区别”这类对比型问题，设计拆解为两条独立检索子查询(Sub-queries)的JSON 输出格式，避免单次检索只召回 A 而漏掉 B",
        "weight": 5.0,
        "type": "term_groups",
        "groups": [
          {
            "label": "子查询",
            "terms": [
              "子查询",
              "sub-query"
            ]
          },
          {
            "label": "JSON",
            "terms": [
              "json"
            ]
          }
        ]
      },
      {
        "id": "c3",
        "label": "说明若用户第 2 轮只是说“谢谢，讲得很清楚”,系统应如何跳过向量库检索以节省延迟",
        "weight": 3.0,
        "type": "term_groups",
        "groups": [
          {
            "label": "跳过",
            "terms": [
              "跳过",
              "检索"
            ]
          },
          {
            "label": "谢谢",
            "terms": [
              "谢谢",
              "寒暄",
              "闲聊"
            ]
          }
        ]
      }
    ]
  },
  "next": "rag-07",
  "knowledgeChecks": [
    {
      "question": "多轮对话中 Query Rewriter 主要解决什么？",
      "options": [
        "指代和上下文缺失导致的检索失败",
        "向量加密",
        "文档分块",
        "结果排序"
      ],
      "answer": 0,
      "explanation": "“它/这个”等追问需要补全主语，才能独立检索。",
      "id": "q1"
    },
    {
      "question": "用户追问“它”时，Query Rewriter 应该？",
      "options": [
        "补全指代，改写成可独立检索的句子",
        "翻译成英文",
        "缩短句子",
        "拆成多个问题"
      ],
      "answer": 0,
      "explanation": "多轮对话中的代词需要结合历史补全，否则检索缺少主语。",
      "id": "q2"
    },
    {
      "question": "“A 与 B 有什么区别”这类问题，更适合？",
      "options": [
        "拆成两个子查询分别检索",
        "只检索一次 A",
        "不检索直接回答",
        "只走图谱"
      ],
      "answer": 0,
      "explanation": "拆成两个子查询能避免只召回 A 而漏掉 B。",
      "id": "q3"
    }
  ],
  "reading": {
    "quote": "ConvoRAG 在传统 RAG 上增加对话历史、查询分类和查询上下文化，使回答能考虑正在进行中的对话。",
    "points": [
      "多轮 RAG 不能只拿当前一句话检索，需要历史上下文。",
      "查询分类可以优化检索路径。",
      "查询上下文化会把简短追问补成可检索的问题。",
      "这些能力对应练习中的 Query Rewriter 和对比型问题拆解。"
    ],
    "guide": "读本关时把“用户原话”与“改写后的检索问题”分开；练习要求先补全代词、再拆子查询。",
    "example": "来源 ConvoRAG README 的对话历史、查询分类、上下文化三项功能，就是本关的来源例子。",
    "takeaway": "多轮 RAG 的第一步是把追问变成完整问题。",
    "refs": [
      [
        "StepByStep-RAG · ConvoRAG",
        "https://github.com/gurucharanmk/StepByStep-RAG/blob/main/ConvoRAG/README.md"
      ],
      [
        "PDF 第 6 关",
        ""
      ]
    ]
  }
}
