{
  "id": "agents-01",
  "trackId": "agents",
  "level": 1,
  "title": "Agent 核心循环与框架选型",
  "summary": "先把 Agent 的循环、触发条件和熔断规则写完整。",
  "source": "Microsoft AI Agents for Beginners (77.2k Stars)",
  "readMinutes": 4,
  "lessonHtml": "<h3>核心原理</h3>\n<p>在 Microsoft AI Agents for Beginners 第 1‒3 课与 Agentic AI Masterclass Exercise 1 中，智能体与普通大模型调用的本质区别在于 ReAct(Reasoning + Acting)循环：模型接收用户目标后，进入“思考(Thought)→ 决定调用工具(Action)→ 获取环境反馈(Observation)→ 再次思考”的循环，直至满足终止条件。在工程实现上，无论是使用 Pydantic AI、LangGraph、CrewAI 还是 OpenAI Agents SDK（详见ed-donner/agents），都必须明确定义四个核心组件：Model（底层推理模型）、Instructions（系统级行为准则）、Tools（可执行外部函数集）与 Loop Guard（最大循环步数限制，防死循环烧钱）。</p>\n<p>踩坑设计 vs. 工业级设计对比：</p>\n<p>新手踩坑设计：把所有业务逻辑硬塞进一个超长 Prompt,既不限制最大迭代步数(max_steps)，也不区分状态变量，一旦外部 API 报错，Agent 就陷入无限重试死循环，几分钟耗尽 API 额度。</p>\n<p>工业级结构化设计：显式声明智能体状态机，设置 max_iterations = 5,并严格规范每一步的 Thought /Action / Observation 输出格式。</p>\n<h2>第 1 关实操练习题：设计“电商机票差价监控与改签助手”的 ReAct 核心循环</h2>\n<h3>任务背景</h3>\n<p>你需要参照 Agentic AI Masterclass 的编码范式，为一个“自动查询航班实时价格并在低于历史购票价 200 元以上时生成改签方案”的智能体编写系统指令与循环终止条件。</p>\n<p>待改造劣质设计：“你是一个机票助手，帮我查一下用户买的航班现在多少钱，如果便宜了就帮他改签。”</p>\n<h3>通关硬性要求（满分 12.5 分）</h3>\n<p>1. 明确写出 Agent 的四步 ReAct 推理轨迹模板：Thought → Action → Observation → Final Decision（4.5 分）；</p>\n<p>2. 定义清晰的触发条件（差价 ≥ 200 元且扣除改签手续费后净省 &gt; 0 元）（4 分）；</p>\n<p>3. 设置防死循环与异常熔断规则（如查询接口连续失败 2 次或总步数达 4 步立即停止并告警）（4 分）。</p>",
  "referenceAnswerHtml": "<h2>System Instructions: Flight Rebooking Agent</h2>\n<p>你是一个严谨的机票差价监控与改签评估智能体。请严格按照以下 ReAct 循环处理用户订单，最大循环步数限制为 max_steps = 4:</p>\n<p>每一步推理必须严格输出以下结构：</p>\n<p>- Thought: 分析当前已知的订单原价、退改签政策与还需获取的实时数据。</p>\n<p>- Action: 调用指定工具（如 get_Order_Info 或 fetch_Live_Flight_Price）。</p>\n<p>- Observation: 接收工具返回的真实 JSON 数据。</p>\n<h2>业务判定与熔断规则</h2>\n<p>1. 净收益计算公式：净节省金额 = （历史出票价 - 当前实时票价） - 改签手续费。</p>\n<p>2. 触发改签方案条件：必须同时满足 （历史出票价 - 当前实时票价） &gt;= 200 元，且净节省金额 &gt; 0 元。若不满足，立即进入 Final Decision 输出“暂不建议改签”及原因。</p>\n<p>3. 异常熔断机制：若外部航班价格接口返回超时或 5xx 错误，最多允许重试 1 次（累计失败达 2 次立即终止循环），严禁盲目重复调用或编造票价，直接输出接口异常告警。</p>\n<h3>得分要点拆解</h3>\n<p>清晰定义四步 ReAct 循环与步数上限（4.5 分）；准确列出差价 ≥ 200 元且扣费后净省 &gt; 0 的双重算式（4 分）；包含连续失败 2 次即熔断告警的防死循环机制（4 分）。</p>",
  "exercise": {
    "id": "agents-01-ex",
    "title": "设计“电商机票差价监控与改签助手”的 ReAct 核心循环",
    "minLength": 40,
    "criteria": [
      {
        "id": "c1",
        "label": "明确写出 Agent 的四步 ReAct 推理轨迹模板：Thought → Action → Observation → Final Decision",
        "weight": 4.5,
        "type": "term_groups",
        "groups": [
          {
            "label": "Thought",
            "terms": [
              "thought"
            ]
          },
          {
            "label": "Action",
            "terms": [
              "action"
            ]
          },
          {
            "label": "Observation",
            "terms": [
              "observation"
            ]
          },
          {
            "label": "Final Decision",
            "terms": [
              "final decision"
            ]
          }
        ]
      },
      {
        "id": "c2",
        "label": "定义清晰的触发条件（差价 ≥ 200 元且扣除改签手续费后净省 > 0 元）",
        "weight": 4.0,
        "type": "term_groups",
        "groups": [
          {
            "label": "差价",
            "terms": [
              "差价",
              "200"
            ]
          },
          {
            "label": "净省",
            "terms": [
              "净省",
              "手续费"
            ]
          }
        ]
      },
      {
        "id": "c3",
        "label": "设置防死循环与异常熔断规则（如查询接口连续失败 2 次或总步数达 4 步立即停止并告警）",
        "weight": 4.0,
        "type": "term_groups",
        "groups": [
          {
            "label": "死循环",
            "terms": [
              "死循环",
              "熔断"
            ]
          },
          {
            "label": "失败",
            "terms": [
              "失败",
              "2 次"
            ]
          },
          {
            "label": "停止",
            "terms": [
              "停止",
              "告警"
            ]
          }
        ]
      }
    ]
  },
  "next": "agents-02",
  "knowledgeChecks": [
    {
      "question": "ReAct 循环的正确顺序是？",
      "options": [
        "Thought → Action → Observation → Final Decision",
        "Action → Thought → Final → Observation",
        "Observation → Final → Action → Thought",
        "Thought → Final → Action → Observation"
      ],
      "answer": 0,
      "explanation": "先推理、再调用工具、读取观察结果，最后给出决定。",
      "id": "q1"
    },
    {
      "question": "ReAct 中执行 Action 之后，下一步应该？",
      "options": [
        "读取 Observation",
        "直接 Final Decision",
        "重新 Thought",
        "停止"
      ],
      "answer": 0,
      "explanation": "工具返回的 Observation 是下一步推理的依据。",
      "id": "q2"
    },
    {
      "question": "设置最大步数和熔断的主要目的是？",
      "options": [
        "防止死循环和异常重试",
        "增加调用成本",
        "让模型更慢",
        "提高温度"
      ],
      "answer": 0,
      "explanation": "步数上限、失败阈值和告警能防止 Agent 无限循环。",
      "id": "q3"
    }
  ],
  "reading": {
    "quote": "Microsoft AI Agents for Beginners 第 1 课：Agent 是让 LLM 真正“做事”的系统，由环境、传感器、执行器以及工具和记忆等部分组成；它不同于只生成文本的普通 LLM。",
    "points": [
      "Agent 是一个系统，不只是模型；环境、感知和执行器共同构成行动闭环。",
      "LLM 负责理解自然语言、推理上下文并把模糊请求转成行动计划。",
      "工具决定 Agent 能做什么，记忆分短期对话和长期知识。",
      "本关的 ReAct 循环（Thought→Action→Observation→Final）是对“感知—行动—反馈”的工程化。"
    ],
    "guide": "读第 1 课后，把练习里的 Model、Instructions、Tools、Loop Guard 四个组件分别对应到来源的系统组成。",
    "example": "来源用旅行 Agent 说明环境/传感器/执行器、工具和记忆；练习的机票改签 Agent 属于同一类多步任务。",
    "takeaway": "Agent 的可靠性来自系统组件和循环，而不是单次回答。",
    "refs": [
      [
        "Microsoft · Lesson 1 Intro to AI Agents",
        "https://github.com/microsoft/ai-agents-for-beginners/blob/main/01-intro-to-ai-agents/README.md"
      ],
      [
        "PDF 第 1 关",
        ""
      ]
    ]
  }
}
